[
  {
    "id": "project-tcm-foundation",
    "name": "项目内整理文本：中医皮肤科/基础理论.txt",
    "sourceType": "local-curated",
    "url": "",
    "allowed": true,
    "copyrightStatus": "internal-curated",
    "usageScope": "knowledge-page-only",
    "checkedBy": "team",
    "checkedAt": "2026-04-12",
    "updatedAt": "2026-04-12",
    "notes": "用于中医皮肤基础静态知识卡，不直接展示原始 txt。"
  },
  {
    "id": "project-western-1",
    "name": "项目内整理文本：西医皮肤科/1.txt",
    "sourceType": "local-curated",
    "url": "",
    "allowed": true,
    "copyrightStatus": "internal-curated",
    "usageScope": "knowledge-page-only",
    "checkedBy": "team",
    "checkedAt": "2026-04-12",
    "updatedAt": "2026-04-12",
    "notes": "用于西医常见问题静态知识卡，脏数据版本已排除。"
  },
  {
    "id": "project-integrated-treatment",
    "name": "项目内整理文本：中西医结合/综合治疗.txt",
    "sourceType": "local-curated",
    "url": "",
    "allowed": true,
    "copyrightStatus": "internal-curated",
    "usageScope": "knowledge-page-only",
    "checkedBy": "team",
    "checkedAt": "2026-04-12",
    "updatedAt": "2026-04-12",
    "notes": "用于中西医结合方案静态知识卡。"
  },
  {
    "id": "candidate-dermnet",
    "name": "DermNet NZ（白名单候选来源）",
    "sourceType": "official-medical",
    "url": "https://dermnetnz.org/",
    "allowed": false,
    "copyrightStatus": "requires-review",
    "usageScope": "future-retrieval-candidate",
    "checkedBy": "team",
    "checkedAt": "2026-04-12",
    "updatedAt": "2026-04-12",
    "notes": "仅登记为后续白名单候选来源，本轮不抓取、不落内容。"
  },
  {
    "id": "candidate-cdc-phil",
    "name": "CDC PHIL（白名单候选来源）",
    "sourceType": "official-public-health",
    "url": "https://wwwn.cdc.gov/phil/default.aspx",
    "allowed": false,
    "copyrightStatus": "requires-review",
    "usageScope": "future-retrieval-candidate",
    "checkedBy": "team",
    "checkedAt": "2026-04-12",
    "updatedAt": "2026-04-12",
    "notes": "仅登记为后续候选来源，需逐项确认版权和使用范围。"
  },
  {
    "id": "candidate-hse-skin",
    "name": "HSE Work-related Skin Disease Library（白名单候选来源）",
    "sourceType": "official-public-health",
    "url": "https://www.hse.gov.uk/skin/imagelibrary.htm",
    "allowed": false,
    "copyrightStatus": "requires-review",
    "usageScope": "future-retrieval-candidate",
    "checkedBy": "team",
    "checkedAt": "2026-04-12",
    "updatedAt": "2026-04-12",
    "notes": "仅登记为候选来源，不默认可直接纳入知识包或图片素材库。"
  },
  {
    "id": "dermnet-psoriasis",
    "name": "DermNet NZ：Psoriasis",
    "sourceType": "official-medical",
    "url": "https://dermnetnz.org/topics/psoriasis",
    "allowed": true,
    "copyrightStatus": "public-reference-only",
    "usageScope": "knowledge-page-only",
    "checkedBy": "team",
    "checkedAt": "2026-04-12",
    "updatedAt": "2026-04-12",
    "notes": "用于前端结构化摘要条目，内容为保守概括，不直接复制原文。"
  },
  {
    "id": "dermnet-rosacea",
    "name": "DermNet NZ：Rosacea",
    "sourceType": "official-medical",
    "url": "https://dermnetnz.org/topics/rosacea",
    "allowed": true,
    "copyrightStatus": "public-reference-only",
    "usageScope": "knowledge-page-only",
    "checkedBy": "team",
    "checkedAt": "2026-04-12",
    "updatedAt": "2026-04-12",
    "notes": "用于前端结构化摘要条目，内容为保守概括。"
  },
  {
    "id": "dermnet-tinea-corporis",
    "name": "DermNet NZ：Tinea corporis",
    "sourceType": "official-medical",
    "url": "https://dermnetnz.org/topics/tinea-corporis",
    "allowed": true,
    "copyrightStatus": "public-reference-only",
    "usageScope": "knowledge-page-only",
    "checkedBy": "team",
    "checkedAt": "2026-04-12",
    "updatedAt": "2026-04-12",
    "notes": "用于真菌感染基础提示条目，内容为概括整理。"
  },
  {
    "id": "dermnet-contact-dermatitis",
    "name": "DermNet NZ：Contact dermatitis",
    "sourceType": "official-medical",
    "url": "https://dermnetnz.org/topics/contact-dermatitis",
    "allowed": true,
    "copyrightStatus": "public-reference-only",
    "usageScope": "knowledge-page-only",
    "checkedBy": "team",
    "checkedAt": "2026-04-12",
    "updatedAt": "2026-04-12",
    "notes": "用于接触性皮炎基础条目，内容为保守概括。"
  },
  {
    "id": "aad-dry-skin-self-care",
    "name": "AAD：How to relieve dry skin",
    "sourceType": "official-medical",
    "url": "https://www.aad.org/diseases/a-z/dry-skin-self-care",
    "allowed": true,
    "copyrightStatus": "public-reference-only",
    "usageScope": "knowledge-page-only",
    "checkedBy": "team",
    "checkedAt": "2026-04-12",
    "updatedAt": "2026-04-12",
    "notes": "用于干燥起皮和敏感肌护理建议条目，内容为保守概括。"
  }
]
